{
  "phase": "author",
  "role": "author",
  "run_id": "run-2026-03-14-user-settings",
  "created_at": "2026-03-14T10:00:00Z",
  "sources": [
    "artifacts/run-2026-03-14/spec.json"
  ],
  "status": "complete",
  "loop_number": 1,
  "microcopy": [
    {
      "key": "settings.title",
      "text": "Settings",
      "context": "Page heading for the user settings screen.",
      "max_length": 30
    },
    {
      "key": "settings.save_button",
      "text": "Save changes",
      "context": "Primary action button at the bottom of the settings form.",
      "max_length": 20
    },
    {
      "key": "settings.cancel_button",
      "text": "Cancel",
      "context": "Secondary action to discard unsaved changes.",
      "max_length": 15
    },
    {
      "key": "settings.unsaved_warning",
      "text": "You have unsaved changes. Are you sure you want to leave?",
      "context": "Confirmation dialog shown when navigating away with pending edits."
    }
  ],
  "i18n_keys": [
    {
      "key": "settings.title",
      "en": "Settings",
      "description": "Page title for user settings."
    },
    {
      "key": "settings.profile_section",
      "en": "Profile",
      "description": "Section heading for profile-related settings."
    },
    {
      "key": "settings.notifications_section",
      "en": "Notifications",
      "description": "Section heading for notification preferences."
    },
    {
      "key": "settings.save_success",
      "en": "Your settings have been saved.",
      "description": "Toast message after successful save."
    }
  ],
  "seed_data": [
    {
      "entity": "notification_preference",
      "records": [
        { "key": "email_digest", "label": "Email digest", "default_enabled": true },
        { "key": "push_alerts", "label": "Push alerts", "default_enabled": false },
        { "key": "weekly_summary", "label": "Weekly summary", "default_enabled": true }
      ]
    },
    {
      "entity": "timezone",
      "records": [
        { "value": "UTC", "label": "UTC (Coordinated Universal Time)" },
        { "value": "America/New_York", "label": "Eastern Time (US & Canada)" },
        { "value": "Europe/London", "label": "London (GMT/BST)" }
      ]
    }
  ],
  "terminology": [
    {
      "term": "settings",
      "definition": "User-configurable preferences that control application behavior.",
      "avoid": ["preferences", "options", "configuration"]
    },
    {
      "term": "profile",
      "definition": "The subset of settings related to the user's identity and display name.",
      "avoid": ["account details", "user info"]
    },
    {
      "term": "notification preference",
      "definition": "A toggleable channel through which the user can receive alerts.",
      "avoid": ["notification setting", "alert config"]
    }
  ],
  "asset_metadata": [
    {
      "asset": "icons/settings-gear.svg",
      "alt_text": "Settings",
      "purpose": "Navigation icon for the settings page."
    },
    {
      "asset": "icons/profile-avatar-placeholder.svg",
      "alt_text": "Default profile picture",
      "purpose": "Placeholder shown when the user has not uploaded an avatar."
    }
  ],
  "state_coverage": {
    "empty": "No settings configured yet. Update your profile to get started.",
    "loading": "Loading your settings...",
    "error": "We could not load your settings. Please try again.",
    "success": "Your settings have been saved.",
    "partial": "Some settings could not be saved. Review the highlighted fields."
  },
  "notifications": [
    {
      "trigger": "settings_saved",
      "message": "Your settings have been saved.",
      "channel": "toast"
    },
    {
      "trigger": "settings_save_failed",
      "message": "We could not save your settings. Please try again.",
      "channel": "toast"
    },
    {
      "trigger": "email_changed",
      "message": "A verification link has been sent to your new email address.",
      "channel": "toast"
    }
  ],
  "editorial_constraints": {
    "tone": "Helpful and straightforward",
    "voice": "Second person (you/your)",
    "reading_level": "Grade 8",
    "banned_words": ["please note", "kindly", "click here", "obviously"]
  },
  "coverage_matrix": [
    {
      "screen": "settings/profile",
      "states_covered": ["empty", "loading", "error", "success"],
      "notes": "Profile photo upload has its own loading state."
    },
    {
      "screen": "settings/notifications",
      "states_covered": ["loading", "error", "success"],
      "notes": "Empty state not applicable; defaults are always present via seed data."
    },
    {
      "screen": "settings/unsaved-dialog",
      "states_covered": ["partial"],
      "notes": "Modal shown only when navigating away with pending changes."
    }
  ]
}
